{
  "id": "mobile.static.analysis.apk",
  "name": "Mobile Static (APK)",
  "category": "Mobile",
  "risk_tier": "recon",
  "description": "Static analysis for Android APKs; manifest, SSL, secrets.",
  "prerequisites": [],
  "exclusive_with": [],
  "requires": {
    "agents": [
      "kali_gateway"
    ],
    "capabilities": [],
    "inputs": [
      "apk_file"
    ]
  },
  "optional_inputs": [],
  "estimator": {
    "time_per_host_sec": 120,
    "cost_units": 4
  },
  "outputs": [
    "mobile_findings"
  ],
  "tool_adapter": "mobile-apk-analyzer@0.2.0",
  "evidence_retention": "standard",
  "policy_tags": []
}
